<?xml version="1.0" encoding="utf-8"?>

<!-- <!DOCTYPE JK_orarend SYSTEM "JK_orarend.dtd"> -->

<JK_orarend xmlns:xsi="http://www.w3.org/2001/XMLSchema-instance" xsi:noNamespaceSchemaLocation="JK_orarend.xsd">
    <ora id="GEIK-01" tipus="Elmélet">
        <targy>WEB Technológiák</targy>
        <idopont>
            <nap>Hétfő</nap>
            <tol>8:00</tol>
            <ig>10:00</ig>
        </idopont>
        <helyszin>XXX A1 III. em. 305</helyszin>
        <oktato>Agárdi Anita</oktato>
        <szak>Programtervező Informatikus</szak>
    </ora>

    <ora id="GEIK-02" tipus="Gyakorlat">
        <targy>WEB Technológiák</targy>
        <idopont>
            <nap>Hétfő</nap>
            <tol>16:00</tol>
            <ig>18:00</ig>
        </idopont>
        <helyszin>Inf 103</helyszin>
        <oktato>Agárdi Anita</oktato>
        <szak>Programtervező Informatikus</szak>
    </ora>

    <ora id="GEIK-03" tipus="Elmélet">
        <targy>Mesterséges Intelligencia Alapjai</targy>
        <idopont>
            <nap>Kedd</nap>
            <tol>9:00</tol>
            <ig>12:00</ig>
        </idopont>
        <helyszin>II A2 mfsz.</helyszin>
        <oktato>Kunné Dr. Tamás Judit</oktato>
        <szak>Programtervező Informatikus</szak>
    </ora>

    <ora id="GEIK-04" tipus="Gyakorlat">
        <targy>Mesterséges Intelligencia Alapjai</targy>
        <idopont>
            <nap>Szerda</nap>
            <tol>14:00</tol>
            <ig>15:00</ig>
        </idopont>
        <helyszin>Inf 15</helyszin>
        <oktato>Fazekas Levente</oktato>
        <szak>Programtervező Informatikus</szak>
    </ora>

    <ora id="GEIK-05" tipus="Elmélet">
        <targy>Adatkezelés XML-ben</targy>
        <idopont>
            <nap>Kedd</nap>
            <tol>12:00</tol>
            <ig>14:00</ig>
        </idopont>
        <helyszin>XXXII A1 magasfsz.</helyszin>
        <oktato>Dr. Bednarik László</oktato>
        <szak>Programtervező Informatikus</szak>
    </ora>

    <ora id="GEIK-06" tipus="Gyakorlat">
        <targy>Adatkezelés XML-ben</targy>
        <idopont>
            <nap>Szerda</nap>
            <tol>12:00</tol>
            <ig>14:00</ig>
        </idopont>
        <helyszin>Inf/101</helyszin>
        <oktato>Dr. Bednarik László</oktato>
        <szak>Programtervező Informatikus</szak>
    </ora>

    <ora id="GEIK-07" tipus="Elmélet">
        <targy>Algoritmusok és Vizsgálatuk</targy>
        <idopont>
            <nap>Kedd</nap>
            <tol>14:00</tol>
            <ig>18:00</ig>
        </idopont>
        <helyszin>X A1 II.em 218</helyszin>
        <oktato>Dr. Házy Attila</oktato>
        <szak>Programtervező Informatikus</szak>
    </ora>

    <ora id="GEIK-08" tipus="Elmélet">
        <targy>Vállalati Információs Rendszerek</targy>
        <idopont>
            <nap>Szerda</nap>
            <tol>16:00</tol>
            <ig>20:00</ig>
        </idopont>
        <helyszin>Inf 103</helyszin>
        <oktato>Dr. Sasvári Péter</oktato>
        <szak>Programtervező Informatikus</szak>
    </ora>

</JK_orarend>